{
  "$schema": "https://json-schema.org/draft/2020-12/schema",
  "title": "data/site.json: la web",
  "description": "data/site.json: lo general de la web y qué proyectos salen en el listado, en qué orden. VS Code lee este fichero (por el \"$schema\" de arriba del JSON) para autocompletar, explicar cada campo y subrayar lo que está mal; el build y la vista previa lo usan para revisar.",
  "type": "object",
  "required": [
    "title",
    "categories",
    "lists"
  ],
  "additionalProperties": false,
  "properties": {
    "$schema": {
      "type": "string"
    },
    "_": {
      "type": "string"
    },
    "url": {
      "type": "string",
      "pattern": "^https://",
      "description": "El dominio, sin barra al final: \"https://bertaesteve.cat\". Con él, Google indexa la web."
    },
    "title": {
      "type": "string",
      "description": "El nombre de la web: \"berta esteve\"."
    },
    "categories": {
      "type": "object",
      "description": "El nombre de cada categoría del listado, en los tres idiomas.",
      "additionalProperties": {
        "description": "El nombre de la categoría.",
        "anyOf": [
          {
            "type": "string",
            "description": "El mismo en los tres idiomas."
          },
          {
            "type": "object",
            "additionalProperties": false,
            "required": [
              "ca"
            ],
            "description": "Uno por idioma: { \"ca\": …, \"es\": …, \"en\": … }",
            "properties": {
              "ca": {
                "type": "string",
                "description": "En catalán."
              },
              "es": {
                "type": "string",
                "description": "En castellano (si falta, sale el catalán)."
              },
              "en": {
                "type": "string",
                "description": "En inglés (si falta, sale el catalán)."
              }
            }
          }
        ]
      }
    },
    "lists": {
      "type": "object",
      "description": "Las categorías, en el orden en que salen, y en cada una sus proyectos, en orden: el nombre de su carpeta de projects/.",
      "additionalProperties": {
        "type": "array",
        "items": {
          "type": "string",
          "pattern": "^[a-z0-9_-]+$",
          "description": "El nombre de la carpeta en projects/: \"caixa-sorpresa\""
        }
      }
    }
  }
}
